{
  "schemaVersion": 1,
  "id": "hearthcode",
  "name": "HearthCode",
  "displayName": "HearthCode Theme",
  "summary": "A low-glare theme family for code interfaces.",
  "brand": {
    "id": "hearthcode-theme",
    "name": "HearthCode Theme",
    "displayName": "HearthCode Theme",
    "summary": "A theme family for code interfaces."
  },
  "publisher": "HearthCode",
  "websiteUrl": "https://theme.hearthcode.dev",
  "author": {
    "name": "HearthCode",
    "url": "https://theme.hearthcode.dev"
  },
  "repository": {
    "url": "https://github.com/hearth-code/HearthTheme",
    "slug": "hearth-code/HearthTheme"
  },
  "supportedSchemeIds": [
    "moss",
    "ember"
  ],
  "flavorNames": {
    "ember": {
      "picker": "Ember",
      "theme": "HearthCode Ember",
      "preview": "Ember"
    },
    "moss": {
      "picker": "Moss",
      "theme": "HearthCode Moss",
      "preview": "Moss"
    }
  },
  "featuredThemes": [
    {
      "id": "moss-dark",
      "schemeId": "moss",
      "variantId": "dark",
      "label": "HearthCode Moss Dark",
      "summary": "Dry charcoal.",
      "isDefault": true
    },
    {
      "id": "moss-light",
      "schemeId": "moss",
      "variantId": "light",
      "label": "HearthCode Moss Light",
      "summary": "Dry paper."
    },
    {
      "id": "ember-dark",
      "schemeId": "ember",
      "variantId": "dark",
      "label": "HearthCode Ember Dark",
      "summary": "Warm charcoal."
    },
    {
      "id": "ember-light",
      "schemeId": "ember",
      "variantId": "light",
      "label": "HearthCode Ember Light",
      "summary": "Warm paper."
    }
  ],
  "brandFlavorIds": [
    "moss",
    "ember"
  ],
  "defaultSchemeId": "moss",
  "channels": {
    "website": true,
    "vscode": true,
    "openvsx": true,
    "obsidian": true,
    "terminal": true,
    "zed": true
  }
}
